{
  "route_receipt": {
    "route_receipt_id": "routercpt_123",
    "tenant_id": "tenant_acme",
    "project_id": "proj_core",
    "route_policy_id": "routepol_default",
    "request_id": "req_123",
    "trace_id": "trace_123",
    "protocol_family": "openai_chat",
    "model_alias": "reasoning-fast",
    "config_snapshot_id": "cfgsnap_default",
    "admission_result": "admitted",
    "selected_target": "prvrsrc_openai_primary",
    "excluded_targets": [
      {
        "provider_resource_id": "prvrsrc_backup",
        "reason_code": "rejected_provenance_class",
        "reason": "rejected_provenance_class"
      }
    ],
    "score_breakdown": {
      "latency": 0.82,
      "cost": 0.66,
      "health": 0.97,
      "trust": 1.0
    },
    "fallback_transitions": [],
    "created_at": "2026-04-21T12:16:00Z"
  },
  "decision_timeline": [
    {
      "stage": "admission",
      "status": "passed",
      "message": "Tenant policy accepted request",
      "score": 1.0,
      "notes": [
        "all constraints satisfied"
      ]
    },
    {
      "stage": "candidate_selection",
      "status": "passed",
      "message": "Selected openai-us-east-primary",
      "score": 0.91,
      "notes": []
    }
  ],
  "policy_checks": [
    {
      "policy_id": "routepol_default",
      "status": "passed",
      "reason": "policy satisfied"
    }
  ],
  "provider_attempts": [
    {
      "provider_resource_id": "prvrsrc_openai_primary",
      "attempt": 1,
      "status": "succeeded",
      "started_at": "2026-04-21T12:16:01Z",
      "finished_at": "2026-04-21T12:16:03Z",
      "latency_ms": 1100,
      "reason": "succeeded with output"
    }
  ],
  "metadata": {
    "candidate_pool_size": "3",
    "policy_cache_hit": "true"
  }
}